sku,parent_sku,locale,attribute_family_code,type,categories,images,name,description,short_description,status,visible_individually,new,featured,guest_checkout,length,width,height,weight,tax_category_name,price,cost,special_price,special_price_from,special_price_to,customer_group_prices,url_key,meta_title,meta_keywords,meta_description,manage_stock,inventories,related_skus,cross_sell_skus,up_sell_skus,configurable_variants,bundle_options,associated_skus,booking_options
SP-001,,en,default,simple,"Men/Winter Wear",1.webp,"Arctic Cozy Knit Unisex Beanie","The Arctic Cozy Knit Beanie is your go-to solution for staying warm, comfortable, and stylish during the colder months. Crafted from a soft and durable blend of acrylic knit, this beanie is designed to provide a cozy and snug fit. The classic design makes it suitable for both men and women, offering a versatile accessory that complements various styles. Whether you're heading out for a casual day in town or embracing the great outdoors, this beanie adds a touch of comfort and warmth to your ensemble. The soft and breathable material ensures that you stay cozy without sacrificing style. The Arctic Cozy Knit Beanie isn't just an accessory; it's a statement of winter fashion. Its simplicity makes it easy to pair with different outfits, making it a staple in your winter wardrobe. Ideal for gifting or as a treat for yourself, this beanie is a thoughtful addition to any winter ensemble. It's a versatile accessory that goes beyond functionality, adding a touch of warmth and style to your look. Embrace the essence of winter with the Arctic Cozy Knit Beanie. Whether you're enjoying a casual day out or facing the elements, let this beanie be your companion for comfort and style. Elevate your winter wardrobe with this classic accessory that effortlessly combines warmth with a timeless sense of fashion.","Embrace the chilly days in style with our Arctic Cozy Knit Beanie. Crafted from a soft and durable blend of acrylic, this classic beanie offers warmth and versatility. Suitable for both men and women, it's the ideal accessory for casual or outdoor wear. Elevate your winter wardrobe or gift someone special with this essential beanie cap.",1,1,0,0,0,,,,1.23,,14,,,,,"group=all,qty=2,type=fixed,price=12|group=all,qty=3,type=discount,price=50",arctic-cozy-knit-unisex-beanie,"Meta Title","meta1, meta2, meta3","meta description",1,default=100,SP-004,SP-004,SP-004,,,,
SP-002,,en,default,simple,"Men/Winter Wear",2.webp,"Arctic Bliss Stylish Winter Scarf","Experience the embrace of warmth and style with our Arctic Bliss Winter Scarf. Crafted from a luxurious blend of acrylic and wool, this cozy scarf is designed to keep you snug during the coldest days. Its stylish and versatile design, combined with an extra-long length, offers customizable styling options. Elevate your winter wardrobe or delight someone special with this essential winter accessory.","The Arctic Bliss Winter Scarf is more than just a cold-weather accessory; it's a statement of warmth, comfort, and style for the winter season. Crafted with care from a luxurious blend of acrylic and wool, this scarf is designed to keep you cozy and snug even in the chilliest temperatures. The soft and plush texture not only provides insulation against the cold but also adds a touch of luxury to your winter wardrobe. The design of the Arctic Bliss Winter Scarf is both stylish and versatile, making it a perfect addition to a variety of winter outfits. Whether you're dressing up for a special occasion or adding a chic layer to your everyday look, this scarf complements your style effortlessly. The extra-long length of the scarf offers customizable styling options. Wrap it around for added warmth, drape it loosely for a casual look, or experiment with different knots to express your unique style. This versatility makes it a must-have accessory for the winter season. Looking for the perfect gift? The Arctic Bliss Winter Scarf is an ideal choice. Whether you're surprising a loved one or treating yourself, this scarf is a timeless and practical gift that will be cherished throughout the winter months. Embrace the winter with the Arctic Bliss Winter Scarf, where warmth meets style in perfect harmony. Elevate your winter wardrobe with this essential accessory that not only keeps you warm but also adds a touch of sophistication to your cold-weather ensemble.",1,1,0,0,0,,,,1,,17,,,,,,arctic-bliss-stylish-winter-scarf,"Meta Title","meta1, meta2, meta4","meta description",1,default=100,SP-001,SP-001,SP-001,,,,
SP-003,,en,default,simple,"Men/Winter Wear",3.webp,"Arctic Touchscreen Winter Gloves","Introducing the Arctic Touchscreen Winter Gloves – where warmth, style, and connectivity meet to enhance your winter experience. Crafted from high-quality acrylic, these gloves are designed to provide exceptional warmth and durability. The touchscreen-compatible fingertips allow you to stay connected without exposing your hands to the cold. Answer calls, send messages, and navigate your devices effortlessly, all while keeping your hands snug. The insulated lining adds an extra layer of coziness, making these gloves your go-to choice for facing the winter chill. Whether you're commuting, running errands, or enjoying outdoor activities, these gloves provide the warmth and protection you need. Elastic cuffs ensure a secure fit, preventing cold drafts and keeping the gloves in place during your daily activities. The stylish design adds a touch of flair to your winter ensemble, making these gloves as fashionable as they are functional. Ideal for gifting or as a treat for yourself, the Arctic Touchscreen Winter Gloves are a must-have accessory for the modern individual. Say goodbye to the inconvenience of removing your gloves to use your devices and embrace the seamless blend of warmth, style, and connectivity. Stay connected, stay warm, and stay stylish with the Arctic Touchscreen Winter Gloves – your reliable companion for conquering the winter season with confidence.","Stay connected and warm with our Arctic Touchscreen Winter Gloves. These gloves are not only crafted from high-quality acrylic for warmth and durability but also feature a touchscreen-compatible design. With an insulated lining, elastic cuffs for a secure fit, and a stylish look, these gloves are perfect for daily wear in chilly conditions.",1,1,0,0,0,,,,1,,21,,17,2024-02-01,2024-02-15,,arctic-touchscreen-winter-gloves,"Meta Title","meta1, meta2, meta5","meta description",1,default=100,"SP-001,SP-002","SP-001,SP-002","SP-001,SP-002",,,,
SP-004,,en,default,simple,"Men/Winter Wear",4.webp,"Arctic Warmth Wool Blend Socks","Introducing the Arctic Warmth Wool Blend Socks – your essential companion for cozy and comfortable feet during the colder seasons. Crafted from a premium blend of Merino wool, acrylic, nylon, and spandex, these socks are designed to provide unparalleled warmth and comfort. The wool blend ensures that your feet stay toasty even in the coldest temperatures, making these socks the perfect choice for winter adventures or simply staying snug at home. The soft and cozy texture of the socks offers a luxurious feel against your skin. Say goodbye to chilly feet as you embrace the plush warmth provided by these wool blend socks. Designed for durability, the socks feature a reinforced heel and toe, adding extra strength to high-wear areas. This ensures that your socks withstand the test of time, providing long-lasting comfort and coziness. The breathable nature of the material prevents overheating, allowing your feet to stay comfortable and dry throughout the day. Whether you're heading outdoors for a winter hike or relaxing indoors, these socks offer the perfect balance of warmth and breathability. Versatile and stylish, these wool blend socks are suitable for various occasions. Pair them with your favorite boots for a fashionable winter look or wear them around the house for ultimate comfort. Elevate your winter wardrobe and prioritize comfort with the Arctic Warmth Wool Blend Socks. Treat your feet to the luxury they deserve and step into a world of coziness that lasts all season long.","Experience the unmatched warmth and comfort of our Arctic Warmth Wool Blend Socks. Crafted from a blend of Merino wool, acrylic, nylon, and spandex, these socks offer ultimate coziness for cold weather. With a reinforced heel and toe for durability, these versatile and stylish socks are perfect for various occasions.",1,1,0,0,0,,,,1,,21,,,,,,arctic-warmth-wool-blend-socks,"Meta Title","meta1, meta2, meta5","meta description",1,default=100,"SP-001,SP-002","SP-001,SP-002","SP-001,SP-002",,,,
GP-001,,en,default,grouped,"Men/Winter Wear",5.webp,"Arctic Frost Winter Accessories","Introducing the Arctic Frost Winter Accessories Bundle, your go-to solution for staying warm, stylish, and connected during the chilly winter days. This thoughtfully curated set brings together Four essential winter accessories to create a harmonious ensemble. The luxurious scarf, woven from a blend of acrylic and wool, not only adds a layer of warmth but also brings a touch of elegance to your winter wardrobe. The soft knit beanie, crafted with care, promises to keep you cozy while adding a fashionable flair to your look. But it doesn't end there – our bundle also includes touchscreen-compatible gloves. Stay connected without sacrificing warmth as you navigate your devices effortlessly. Whether you're answering calls, sending messages, or capturing winter moments on your smartphone, these gloves ensure convenience without compromising style. The soft and cozy texture of the socks offers a luxurious feel against your skin. Say goodbye to chilly feet as you embrace the plush warmth provided by these wool blend socks. The Arctic Frost Winter Accessories Bundle is not just about functionality; it's a statement of winter fashion. Each piece is designed not only to protect you from the cold but also to elevate your style during the frosty season. The materials chosen for this bundle prioritize both durability and comfort, ensuring that you can enjoy the winter wonderland in style. Whether you're treating yourself or searching for the perfect gift, the Arctic Frost Winter Accessories Bundle is a versatile choice. Delight someone special during the holiday season or elevate your own winter wardrobe with this stylish and functional ensemble. Embrace the frost with confidence, knowing that you have the perfect accessories to keep you warm and chic.","Embrace the winter chill with our Arctic Frost Winter Accessories Bundle. This curated set includes a luxurious scarf, a cozy beanie, touchscreen-compatible gloves and wool Blend Socks. Stylish and functional, this ensemble is crafted from high-quality materials, ensuring both durability and comfort. Elevate your winter wardrobe or delight someone special with this perfect gifting option.",1,1,0,0,0,,,,,,,,,,,,arctic-frost-winter-accessories,"Meta Title","meta1, meta2, meta6","meta description",,,,,,,,"SP-001=5,SP-003=5,SP-004=5",
BP-001,,en,default,bundle,"Men/Winter Wear",5.webp,"Arctic Frost Winter Accessories Bundle","Introducing the Arctic Frost Winter Accessories Bundle, your go-to solution for staying warm, stylish, and connected during the chilly winter days. This thoughtfully curated set brings together Four essential winter accessories to create a harmonious ensemble. The luxurious scarf, woven from a blend of acrylic and wool, not only adds a layer of warmth but also brings a touch of elegance to your winter wardrobe. The soft knit beanie, crafted with care, promises to keep you cozy while adding a fashionable flair to your look. But it doesn't end there – our bundle also includes touchscreen-compatible gloves. Stay connected without sacrificing warmth as you navigate your devices effortlessly. Whether you're answering calls, sending messages, or capturing winter moments on your smartphone, these gloves ensure convenience without compromising style. The soft and cozy texture of the socks offers a luxurious feel against your skin. Say goodbye to chilly feet as you embrace the plush warmth provided by these wool blend socks. The Arctic Frost Winter Accessories Bundle is not just about functionality; it's a statement of winter fashion. Each piece is designed not only to protect you from the cold but also to elevate your style during the frosty season. The materials chosen for this bundle prioritize both durability and comfort, ensuring that you can enjoy the winter wonderland in style. Whether you're treating yourself or searching for the perfect gift, the Arctic Frost Winter Accessories Bundle is a versatile choice. Delight someone special during the holiday season or elevate your own winter wardrobe with this stylish and functional ensemble. Embrace the frost with confidence, knowing that you have the perfect accessories to keep you warm and chic.","Embrace the winter chill with our Arctic Frost Winter Accessories Bundle. This curated set includes a luxurious scarf, a cozy beanie, touchscreen-compatible gloves and wool Blend Socks. Stylish and functional, this ensemble is crafted from high-quality materials, ensuring both durability and comfort. Elevate your winter wardrobe or delight someone special with this perfect gifting option.",1,1,0,0,0,,,,,,,,,,,,arctic-frost-winter-accessories-bundle,"Meta Title","meta1, meta2, meta8","meta description",,,,,,,"name=Bundle Option 1,type=radio,required=1,sku=SP-001,price=15.00,default=0,qty=1|name=Bundle Option 1,type=radio,required=1,sku=SP-002,price=10.0000,default=1,qty=2|name=Bundle Option 2,type=checkbox,required=1,sku=SP-003,price=15.0000,default=1,qty=1|name=Bundle Option 2,type=checkbox,required=1,sku=SP-004,price=10.0000,default=0,qty=2",,
CP-001,,en,default,configurable,"Men/Winter Wear","6.webp,7.webp,8.webp","OmniHeat Men's Solid Hooded Puffer Jacket","Introducing the OmniHeat Men's Solid Hooded Puffer Jacket, your go-to solution for staying warm and fashionable during colder seasons. This jacket is crafted with durability and warmth in mind, ensuring it becomes your trusted companion. The hooded design not only adds a touch of style but also provides additional warmth, shielding you from cold winds and weather. The full sleeves offer complete coverage, ensuring you stay cozy from shoulder to wrist. Equipped with insert pockets, this puffer jacket provides convenience for carrying your essentials or keeping your hands warm. The insulated synthetic filling offers enhanced warmth, making it ideal for battling chilly days and nights. Made from a durable polyester shell and lining, this jacket is built to last and endure the elements. Available in 5 attractive colors, you can choose the one that suits your style and preference. Versatile and functional, the OmniHeat Men's Solid Hooded Puffer Jacket is suitable for various occasions, whether you're heading to work, going for a casual outing, or attending an outdoor event. Experience the perfect blend of style, comfort, and functionality with OmniHeat Men's Solid Hooded Puffer Jacket. Elevate your winter wardrobe and stay snug while embracing the outdoors. Beat the cold in style and make a statement with this essential piece.","Stay warm and stylish with our OmniHeat Men's Solid Hooded Puffer Jacket. This jacket is designed to provide ultimate warmth and features insert pockets for added convenience. The insulated material ensures you stay cozy in cold weather. Available in 5 attractive colors, making it a versatile choice for various occasions.",1,1,0,0,0,,,,,,,,,,,,omniheat-mens-solid-hooded-puffer-jacket,"Meta Title","meta1, meta2, meta6","meta description",,,,,,"sku=SP-005,color=Yellow,size=M|sku=SP-006,color=Yellow,size=L|sku=SP-007,color=Green,size=M|sku=SP-008,color=Green,size=L",,,
SP-005,CP-001,en,default,simple,"Men/Winter Wear","9.webp,10.webp","OmniHeat Men's Solid Hooded Puffer Jacket-Blue-Yellow-M","Introducing the OmniHeat Men's Solid Hooded Puffer Jacket, your go-to solution for staying warm and fashionable during colder seasons. This jacket is crafted with durability and warmth in mind, ensuring it becomes your trusted companion. The hooded design not only adds a touch of style but also provides additional warmth, shielding you from cold winds and weather. The full sleeves offer complete coverage, ensuring you stay cozy from shoulder to wrist. Equipped with insert pockets, this puffer jacket provides convenience for carrying your essentials or keeping your hands warm. The insulated synthetic filling offers enhanced warmth, making it ideal for battling chilly days and nights. Made from a durable polyester shell and lining, this jacket is built to last and endure the elements. Available in 5 attractive colors, you can choose the one that suits your style and preference. Versatile and functional, the OmniHeat Men's Solid Hooded Puffer Jacket is suitable for various occasions, whether you're heading to work, going for a casual outing, or attending an outdoor event. Experience the perfect blend of style, comfort, and functionality with OmniHeat Men's Solid Hooded Puffer Jacket. Elevate your winter wardrobe and stay snug while embracing the outdoors. Beat the cold in style and make a statement with this essential piece.","Stay warm and stylish with our OmniHeat Men's Solid Hooded Puffer Jacket. This jacket is designed to provide ultimate warmth and features insert pockets for added convenience. The insulated material ensures you stay cozy in cold weather. Available in 5 attractive colors, making it a versatile choice for various occasions.",1,0,0,0,0,,,,1.23,,14,,,,,,omniheat-mens-solid-hooded-puffer-jacket-blue-yellow-m,"Meta Title","meta1, meta2, meta3","meta description",1,default=100,,,,,,,
SP-006,CP-001,en,default,simple,"Men/Winter Wear","9.webp,10.webp","OmniHeat Men's Solid Hooded Puffer Jacket-Blue-Yellow-L","DescIntroducing the OmniHeat Men's Solid Hooded Puffer Jacket, your go-to solution for staying warm and fashionable during colder seasons. This jacket is crafted with durability and warmth in mind, ensuring it becomes your trusted companion. The hooded design not only adds a touch of style but also provides additional warmth, shielding you from cold winds and weather. The full sleeves offer complete coverage, ensuring you stay cozy from shoulder to wrist. Equipped with insert pockets, this puffer jacket provides convenience for carrying your essentials or keeping your hands warm. The insulated synthetic filling offers enhanced warmth, making it ideal for battling chilly days and nights. Made from a durable polyester shell and lining, this jacket is built to last and endure the elements. Available in 5 attractive colors, you can choose the one that suits your style and preference. Versatile and functional, the OmniHeat Men's Solid Hooded Puffer Jacket is suitable for various occasions, whether you're heading to work, going for a casual outing, or attending an outdoor event. Experience the perfect blend of style, comfort, and functionality with OmniHeat Men's Solid Hooded Puffer Jacket. Elevate your winter wardrobe and stay snug while embracing the outdoors. Beat the cold in style and make a statement with this essential piece.ription 9","Stay warm and stylish with our OmniHeat Men's Solid Hooded Puffer Jacket. This jacket is designed to provide ultimate warmth and features insert pockets for added convenience. The insulated material ensures you stay cozy in cold weather. Available in 5 attractive colors, making it a versatile choice for various occasions.",1,0,0,0,0,,,,1,,17,,,,,,omniheat-mens-solid-hooded-puffer-jacket-blue-yellow-l,"Meta Title","meta1, meta2, meta4","meta description",1,default=100,,,,,,,
SP-007,CP-001,en,default,simple,"Men/Winter Wear","11.webp,12.webp","OmniHeat Men's Solid Hooded Puffer Jacket-Blue-Green-M","Introducing the OmniHeat Men's Solid Hooded Puffer Jacket, your go-to solution for staying warm and fashionable during colder seasons. This jacket is crafted with durability and warmth in mind, ensuring it becomes your trusted companion. The hooded design not only adds a touch of style but also provides additional warmth, shielding you from cold winds and weather. The full sleeves offer complete coverage, ensuring you stay cozy from shoulder to wrist. Equipped with insert pockets, this puffer jacket provides convenience for carrying your essentials or keeping your hands warm. The insulated synthetic filling offers enhanced warmth, making it ideal for battling chilly days and nights. Made from a durable polyester shell and lining, this jacket is built to last and endure the elements. Available in 5 attractive colors, you can choose the one that suits your style and preference. Versatile and functional, the OmniHeat Men's Solid Hooded Puffer Jacket is suitable for various occasions, whether you're heading to work, going for a casual outing, or attending an outdoor event. Experience the perfect blend of style, comfort, and functionality with OmniHeat Men's Solid Hooded Puffer Jacket. Elevate your winter wardrobe and stay snug while embracing the outdoors. Beat the cold in style and make a statement with this essential piece.","Stay warm and stylish with our OmniHeat Men's Solid Hooded Puffer Jacket. This jacket is designed to provide ultimate warmth and features insert pockets for added convenience. The insulated material ensures you stay cozy in cold weather. Available in 5 attractive colors, making it a versatile choice for various occasions.",1,0,0,0,0,,,,1,,21,,17,2024-02-01,2024-02-15,,omniheat-mens-solid-hooded-puffer-jacket-blue-green-m,"Meta Title","meta1, meta2, meta5","meta description",1,default=100,,,,,,,
SP-008,CP-001,en,default,simple,"Men/Winter Wear","11.webp,12.webp","OmniHeat Men's Solid Hooded Puffer Jacket-Blue-Green-L","Introducing the OmniHeat Men's Solid Hooded Puffer Jacket, your go-to solution for staying warm and fashionable during colder seasons. This jacket is crafted with durability and warmth in mind, ensuring it becomes your trusted companion. The hooded design not only adds a touch of style but also provides additional warmth, shielding you from cold winds and weather. The full sleeves offer complete coverage, ensuring you stay cozy from shoulder to wrist. Equipped with insert pockets, this puffer jacket provides convenience for carrying your essentials or keeping your hands warm. The insulated synthetic filling offers enhanced warmth, making it ideal for battling chilly days and nights. Made from a durable polyester shell and lining, this jacket is built to last and endure the elements. Available in 5 attractive colors, you can choose the one that suits your style and preference. Versatile and functional, the OmniHeat Men's Solid Hooded Puffer Jacket is suitable for various occasions, whether you're heading to work, going for a casual outing, or attending an outdoor event. Experience the perfect blend of style, comfort, and functionality with OmniHeat Men's Solid Hooded Puffer Jacket. Elevate your winter wardrobe and stay snug while embracing the outdoors. Beat the cold in style and make a statement with this essential piece.","Stay warm and stylish with our OmniHeat Men's Solid Hooded Puffer Jacket. This jacket is designed to provide ultimate warmth and features insert pockets for added convenience. The insulated material ensures you stay cozy in cold weather. Available in 5 attractive colors, making it a versatile choice for various occasions.",1,0,0,0,0,,,,1,,21,,17,2024-02-01,2024-02-15,,omniheat-mens-solid-hooded-puffer-jacket-blue-green-l,"Meta Title","meta1, meta2, meta5","meta description",1,default=100,,,,,,,
BKP-DEFAULT-001,,en,default,booking,"Men/Winter Wear",,"Weekly Yoga Retreat - One Booking for Many Days","A multi-day yoga retreat that runs weekly from Monday to Friday.","Weekly multi-day yoga retreat.",1,1,,,,,,,,,250,,,,,,weekly-yoga-retreat-multi-day,"Weekly Yoga Retreat - One Booking for Many Days",,"Weekly multi-day yoga retreat.",0,,,,,,,,"type=default,qty=10,location=Mountain Retreat Center,show_location=1,available_from=2026-05-01,available_to=2027-12-31,allow_cancellation=1|booking_type=one|from_day=1,from=09:00,to_day=5,to=17:00"
BKP-DEFAULT-002,,en,default,booking,"Men/Winter Wear",,"Weekly Workshop - Many Bookings Per Day","Recurring workshop available multiple days per week with single slot per day.","Weekly workshop slots.",1,1,,,,,,,,,30,,,,,,weekly-workshop-many-bookings,"Weekly Workshop - Many Bookings Per Day",,"Weekly workshop slots.",0,,,,,,,,"type=default,qty=10,location=Main Hall,show_location=1,available_from=2026-05-01,available_to=2027-12-31,allow_cancellation=1|booking_type=many,duration=60,break_time=15|day=1,from=09:00,to=17:00|day=3,from=10:00,to=16:00|day=5,from=09:00,to=15:00"
BKP-DEFAULT-003,,en,default,booking,"Men/Winter Wear",,"Seasonal Cruise - One Booking for Many Days","A summer cruise available only during the June-August window, running weekend to weekend.","Seasonal multi-day cruise.",1,1,,,,,,,,,800,,,,,,seasonal-cruise-multi-day,"Seasonal Cruise - One Booking for Many Days",,"Seasonal multi-day cruise.",0,,,,,,,,"type=default,qty=5,location=Harbor Dock 12,show_location=1,available_every_week=0,available_from=2026-06-01,available_to=2026-08-31,allow_cancellation=0|booking_type=one|from_day=6,from=16:00,to_day=6,to=22:00"
